{
  "adrs": [],
  "approved_by": null,
  "background": "执行收据 repo_id 绑定绝对路径；同一 commit 复制到新路径后 verify_receipt 失败，阻断独立 Clone 复核。",
  "constraints": [
    "不修改 B1–B5 行为",
    "不删除/跳过既有测试",
    "不静默重写历史收据"
  ],
  "created_at": "2026-10-28T01:32:37+00:00",
  "history": [
    {
      "at": "2026-10-28T01:32:37+00:00",
      "by": "PM-01",
      "from": null,
      "reason": "created",
      "to": "proposed"
    }
  ],
  "id": "G-B0",
  "issues": [],
  "kind": "goal",
  "outcome": "同一仓库的独立 Clone/不同路径可以互相验证收据；不同仓库的收据仍被拒绝；签名与内容绑定不削弱。",
  "owner": "PM-01",
  "prs": [],
  "revision": 1,
  "schema_version": "1.2",
  "status": "proposed",
  "success_criteria": [
    {
      "evidence": [],
      "id": "C1",
      "required": true,
      "statement": "路径 A 生成的收据在路径 B 验证通过"
    },
    {
      "evidence": [],
      "id": "C2",
      "required": true,
      "statement": "不同仓库的收据被拒绝"
    },
    {
      "evidence": [],
      "id": "C3",
      "required": true,
      "statement": "仓库身份不含绝对路径，Clone/CI 路径变化不影响"
    },
    {
      "evidence": [],
      "id": "C4",
      "required": true,
      "statement": "旧路径绑定收据不被静默跨路径接受"
    },
    {
      "evidence": [],
      "id": "C5",
      "required": true,
      "statement": "既有 147 项测试与新增正负测试全绿"
    }
  ],
  "title": "B0 可移植的仓库身份",
  "updated_at": "2026-10-28T01:32:37+00:00"
}
