{
  "adrs": [],
  "approved_by": null,
  "background": "RC3 独立复核 B1：authority._openssl 用 PATH/PROJECT_MEMORY_OPENSSL 解析验签器，只信任退出码；Agent 可替换验签器使伪造签名被接受。",
  "constraints": [
    "不修改任务卡/判据/探针/评测器",
    "不删除/跳过既有测试",
    "不读取私钥或自行签名"
  ],
  "created_at": "2026-10-27T13:36:55+00:00",
  "history": [
    {
      "at": "2026-10-27T13:36:55+00:00",
      "by": "PM-01",
      "from": null,
      "reason": "created",
      "to": "proposed"
    }
  ],
  "id": "G-B1",
  "issues": [],
  "kind": "goal",
  "outcome": "Agent 不能通过 PATH 或 PROJECT_MEMORY_OPENSSL 替换验签器；有效签名仍可验证；攻击链不能到达 achieved。",
  "owner": "PM-01",
  "prs": [],
  "revision": 1,
  "schema_version": "1.2",
  "status": "proposed",
  "success_criteria": [
    {
      "evidence": [],
      "id": "C1",
      "required": true,
      "statement": "PATH 替换被拒绝，伪造签名不被接受"
    },
    {
      "evidence": [],
      "id": "C2",
      "required": true,
      "statement": "PROJECT_MEMORY_OPENSSL=/bin/true 与假 openssl 被拒绝"
    },
    {
      "evidence": [],
      "id": "C3",
      "required": true,
      "statement": "有效签名 fixture 仍能通过验证"
    },
    {
      "evidence": [],
      "id": "C4",
      "required": true,
      "statement": "原始探针攻击链不能到达 achieved"
    },
    {
      "evidence": [],
      "id": "C5",
      "required": true,
      "statement": "既有 147 项测试与新增负向测试全部通过"
    }
  ],
  "title": "B1 固定签名验证器，阻断 PATH/环境变量替换",
  "updated_at": "2026-10-27T13:36:55+00:00"
}
